FieldNumber,Priority,TAG,FieldName,Category,DataType,Definition,Guidance
AR194,Mandatory,static,Number of County Court Judgements or equivalent - Unsatisfied  (Second Borrower),Borrower Information,Numeric,Number of CCJs or equivalent recorded against the primary borrower that were unsatisfied at time of underwriting,Relevant to secondary borrower only. Either field AR194 or AR195 can be provided if both are not available
AR195,Mandatory,static,Value of County Court Judgements or equivalent - Unsatisfied  (Second Borrower),Borrower Information,Numeric,Total value of CCJs or equivalent recorded against the primary borrower that were unsatisfied at time of underwriting,Relevant to secondary borrower only. Either field AR194 or AR195 can be provided if both are not available
AR196,Optional,static,Last County Court Judgements or equivalent – Date  (Second Borrower),Borrower Information,Date / ND,Date last CCJ or equivalent was registered against the primary borrower regardless of satisfied or not,Relevant to secondary borrower only
AR197,Mandatory,dynamic,Bankruptcy or Individual Voluntary Arrangement Flag (Second Borrower),Borrower Information,Y / N / ND,Flag to identify if borrower has been bankrupt or had an Individual Voluntary Arrangement (IVA) or equivalent.,"Relevant to secondary borrower only. To be updated on a monthly basis in the case of raw loan pools. If updated Bankruptcy data are not regularly collected, BoE does not expect you to start collecting this. However, where data are available or you are notified of a borrower bankruptcy, this should be reported in the relevant fields."
AR198,Optional,static,Bureau Krediet Registratie 1 to 10 - Credit Type (Second Borrower),Borrower Information,List,Credit type according to the coding of Bureau Krediet Registratie (BKR) (Netherlands only) AK - Loans which have to pay back in a predefined period RK - Loans with a maximum credit amount SR - Loan with the aim to re-arrange previous credits VK - Credit maximum with respect to goods ordered with mail-order companies HY - mortgage loans TC - telecom credits RO - Other credit ND - No Data,Relevant to secondary borrower only
AR199,Optional,static,Bureau Krediet Registratie 1 to 10- Registration Date (Second Borrower),Borrower Information,Date,Registration date of the BKR,Relevant to secondary borrower only
AR200,Optional,static,Bureau Krediet Registratie 1 to 10 - Arrears Code  (Second Borrower),Borrower Information,List,Arrears code according to the coding of Bureau Krediet Registratie (BKR) (Netherlands only) A - arrears AH - arrears repaid A1 - settlement reached A2 - remaining outstanding is summoned A3 - an amount > Euro 250 is depreciated A4 - person disappeared ND - No Data,Relevant to secondary borrower only
AR201,Optional,static,Bureau Krediet Registratie 1 to 10 - Credit Amount  (Second Borrower),Borrower Information,Numeric,Amount of the credit (Netherlands only),Relevant to secondary borrower only
AR202,Optional,static,Bureau Krediet Registratie 1 to 10 - Is Coding Cured?  (Second Borrower),Borrower Information,Y / N / ND,Is the coding with BKR cured? (Netherlands only),Relevant to secondary borrower only
AR203,Optional,static,Bureau Krediet Registratie 1 to 10 - Number of Months Since Cured  (Second Borrower),Borrower Information,Numeric,"If the coding is cured, number of months since it is cured (Netherlands only)",Relevant to secondary borrower only
AR204,Mandatory,dynamic,Bureau Score Provider  (Second Borrower),Borrower Information,List,Who has provided the score. For continental Europe give name of provider: Callcredit (1) Experian (2) Equifax (3) Schufa (4) Bureau Krediet Registratie (BKR) (5) Internal Score (6) Other (7) No Data (ND),Relevant to secondary borrower only
AR205,Mandatory,dynamic,Bureau Score Type  (Second Borrower),Borrower Information,List,Type of scorecard provided: Generation 8 B&F AAM - DCM (Experian) (1) Generation 8 B&F CRS - DCM (Experian) (2) Generation 7 Mortgage PD Score - DCM (Experian) (3) FSC109 - Risk Navigator (Equifax) (4) RNILF02 - Risk Navigator (Equifax) (5) RNISF02 - Risk Navigator (Equifax) (6) Internal Scorecard (7) Other (8) No Data (ND),Relevant to secondary borrower only
AR206,Mandatory,dynamic,Bureau Score Date  (Second Borrower),Borrower Information,Date,The date of the bureau score for this borrower,Relevant to secondary borrower only
AR207,Mandatory,dynamic,Bureau Score Value  (Second Borrower),Borrower Information,Text/Numeric,Borrower's score: >0 Regular Score -999 CAIS for mortgage not available -998 Notice of Correction or Notice of Dispute 0 Bankruptcy Restriction Order or Bankruptcy Restriction Undertaking ND - No Data,Relevant to secondary borrower only
AR208,Optional,static,Prior Repossessions (Second Borrower),Borrower Information,Y / N / ND,Indicator of prior repossessions resulting from a borrower defaulting on a previous mortgage loan,Applicable to secondary borrower only
AR209,Optional,static,Previous Mortgage Arrears 0-6 Months (Second Borrower),Borrower Information,Numeric / ND,Number of payments missed on previous mortgage in the prior 0-6 months (information as at underwriting). If no data available specify No Data (ND),Applicable to secondary borrower only
AR210,Optional,static,Previous Mortgage Arrears 6+ Months (Second Borrower),Borrower Information,Numeric / ND,"Number of payments missed on previous mortgage in the prior months, greater or equal than 6 months (information as at underwriting) If no data available specify No Data (ND)",Applicable to secondary borrower only
AR211,Optional,static,Bureau Krediet Registratie 1 to 10 - Credit Type (Primary Borrower - At Origination),Borrower Information (At Origination),List,Credit type according to the coding of Bureau Krediet Registratie (BKR) (Netherlands only) AK - Loans which have to pay back in a predefined period RK - Loans with a maximum credit amount SR - Loan with the aim to re-arrange previous credits VK - Credit maximum with respect to goods ordered with mail-order companies HY - mortgage loans TC - telecom credits RO - Other credit ND - No Data,Applicable to primary borrower only. The score provided should be within 3 months of origination.
AR213,Optional,static,Bureau Krediet Registratie 1 to 10 - Arrears Code (Primary Borrower - At Origination),Borrower Information (At Origination),List,Arrears code according to the coding of Bureau Krediet Registratie (BKR) (Netherlands only) A - arrears AH - arrears repaid A1 - settlement reached A2 - remaining outstanding is summoned A3 - an amount > Euro 250 is depreciated A4 - person disappeared ND - No Data,Applicable to primary borrower only. The score provided should be within 3 months of origination.
AR214,Optional,static,Bureau Krediet Registratie 1 to 10 - Credit Amount (Primary Borrower - At Origination),Borrower Information (At Origination),Numeric,Amount of the credit (Netherlands only),Applicable to primary borrower only. The score provided should be within 3 months of origination.
AR215,Optional,static,Bureau Krediet Registratie 1 to 10 - Is Coding Cured? (Primary Borrower - At Origination),Borrower Information (At Origination),Y / N / ND,Is the coding with BKR cured? (Netherlands only),Applicable to primary borrower only. The score provided should be within 3 months of origination.
AR216,Optional,static,Bureau Krediet Registratie 1 to 10 - Number of Months Since Cured (Primary Borrower - At Origination),Borrower Information (At Origination),Numeric,"If the coding is cured, number of months since it is cured (Netherlands only)",Applicable to primary borrower only. The score provided should be within 3 months of origination.
AR217,Mandatory,static,Bureau Score Provider (Primary Borrower - At Origination),Borrower Information (At Origination),List,Who has provided the score. For continental Europe give name of provider: Callcredit (1) Experian (2) Equifax (3) Schufa (4) Bureau Krediet Registratie (BKR) (5) Internal Score (6) Other (7) No Data (ND),Applicable to primary borrower only. The score provided should be within 3 months of origination.
AR218,Mandatory,static,Bureau Score Type (Primary Borrower - At Origination),Borrower Information (At Origination),List,Type of scorecard provided: Generation 8 B&F AAM - DCM (Experian) (1) Generation 8 B&F CRS - DCM (Experian) (2) Generation 7 Mortgage PD Score - DCM (Experian) (3) FSC109 - Risk Navigator (Equifax) (4) RNILF02 - Risk Navigator (Equifax) (5) RNISF02 - Risk Navigator (Equifax) (6) Internal Scorecard (7) Other (8) No Data (ND),Applicable to primary borrower only. The score provided should be within 3 months of origination.
AR220,Mandatory,static,Bureau Score Value (Primary Borrower - At Origination),Borrower Information (At Origination),Text/Numeric,Borrower's score: >0 Regular Score -999 CAIS for mortgage not available -998 Notice of Correction or Notice of Dispute 0 Bankruptcy Restriction Order or Bankruptcy Restriction Undertaking ND - No Data,Applicable to primary borrower only. The score provided should be within 3 months of origination.
AR221,Optional,static,Bureau Krediet Registratie 1 to 10 - Credit Type (Secondary Borrower - At Origination),Borrower Information (At Origination),List,Credit type according to the coding of Bureau Krediet Registratie (BKR) (Netherlands only) AK - Loans which have to pay back in a predefined period RK - Loans with a maximum credit amount SR - Loan with the aim to re-arrange previous credits VK - Credit maximum with respect to goods ordered with mail-order companies HY - mortgage loans TC - telecom credits RO - Other credit ND - No Data,Applicable to secondary borrower only. The score provided should be within 3 months of origination.
AR222,Optional,static,Bureau Krediet Registratie 1 to 10- Registration Date (Secondary Borrower - At Origination),Borrower Information (At Origination),Date,Registration date of the BKR,Applicable to secondary borrower only. The score provided should be within 3 months of origination.
AR223,Optional,static,Bureau Krediet Registratie 1 to 10 - Arrears Code (Secondary Borrower - At Origination),Borrower Information (At Origination),List,Arrears code according to the coding of Bureau Krediet Registratie (BKR) (Netherlands only) A - arrears AH - arrears repaid A1 - settlement reached A2 - remaining outstanding is summoned A3 - an amount > Euro 250 is depreciated A4 - person disappeared ND - No Data,Applicable to secondary borrower only. The score provided should be within 3 months of origination.
AR224,Optional,static,Bureau Krediet Registratie 1 to 10 - Credit Amount (Secondary Borrower - At Origination),Borrower Information (At Origination),Numeric,Amount of the credit (Netherlands only),Applicable to secondary borrower only. The score provided should be within 3 months of origination.
AR225,Optional,static,Bureau Krediet Registratie 1 to 10 - Is Coding Cured? (Secondary Borrower - At Origination),Borrower Information (At Origination),Y / N / ND,Is the coding with BKR cured? (Netherlands only),Applicable to secondary borrower only. The score provided should be within 3 months of origination.
AR226,Optional,static,Bureau Krediet Registratie 1 to 10 - Number of Months Since Cured (Secondary Borrower - At Origination),Borrower Information (At Origination),Numeric,"If the coding is cured, number of months since it is cured (Netherlands only)",Applicable to secondary borrower only. The score provided should be within 3 months of origination.
AR227,Mandatory,static,Bureau Score Provider  (Secondary Borrower - At Origination),Borrower Information (At Origination),List,Who has provided the score. For continental Europe give name of provider: Callcredit (1) Experian (2) Equifax (3) Schufa (4) Bureau Krediet Registratie (BKR) (5) Internal Score (6) Other (7) No Data (ND),Applicable to secondary borrower only. The score provided should be within 3 months of origination.
AR228,Mandatory,static,Bureau Score Type  (Secondary Borrower - At Origination),Borrower Information (At Origination),List,Type of scorecard provided: Generation 8 B&F AAM - DCM (Experian) (1) Generation 8 B&F CRS - DCM (Experian) (2) Generation 7 Mortgage PD Score - DCM (Experian) (3) FSC109 - Risk Navigator (Equifax) (4) RNILF02 - Risk Navigator (Equifax) (5) RNISF02 - Risk Navigator (Equifax) (6) Internal Scorecard (7) Other (8) No Data (ND),Applicable to secondary borrower only. The score provided should be within 3 months of origination.
AR230,Mandatory,static,Bureau Score Value (Secondary Borrower - At Origination),Borrower Information (At Origination),Text/Numeric,Borrower's score: >0 Regular Score -999 CAIS for mortgage not available -998 Notice of Correction or Notice of Dispute 0 Bankruptcy Restriction Order or Bankruptcy Restriction Undertaking ND - No Data,The score provided should be within 3 months of origination
AR231,Optional,static,Borrower Type (Secondary Borrower),Borrower Information,List,The type of borrower IND - individual COM - commercial SCI - Société Civile Immobilière ND - No Data,Applicable to secondary borrower only. The score provided should be within 3 months of origination.
AR232,Optional,static,Foreign National (Secondary Borrower),Borrower Information,Y / N / ND,Indicating whether the borrower is a national of the country in which the property and mortgage loan resides.,Applicable to secondary borrower only. The score provided should be within 3 months of origination.
AR233,Optional,static,Borrower Credit Quality (Secondary Borrower),Borrower Information,Text,Originators own definition of borrower credit quality Free text using originator own terms ND - No Data,"Consistent terminology (e.g.. prime, sub-prime, etc.) should be used by each Issuer with definitions / explanations provided in the reporting glossary. The Score provided should be within 3 months of origination."
AR234,Optional,static,First-time Buyer (Secondary Borrower),Borrower Information,Y / N / ND,First time buyer flag,Applicable to secondary borrower only. The score provided should be within 3 months of origination.
AR235,Mandatory,static,Bankruptcy or Individual Voluntary Arrangement Flag,Borrower Information,Y / N / ND,Flag to identify if borrower has been bankrupt or had an Individual Voluntary Arrangement (IVA) or equivalent.,Relates to primary borrower only. To be completed with data correct as at the date the loan was originated.
AR236,Mandatory,static,Bankruptcy or Individual Voluntary Arrangement Flag (Second Borrower),Borrower Information,Y / N / ND,Flag to identify if borrower has been bankrupt or had an Individual Voluntary Arrangement (IVA) or equivalent.,Relates to secondary borrower only. To be completed with data correct as at the date the loan was originated.
