FieldNumber,Priority,TAG,FieldName,Category,DataType,Definition,Guidance
AR93,Optional,dynamic,Subsidy Period,Loan Characteristics,Numeric,Number of months until end of subsidy period,nan
AR94,Optional,static,Mortgage Inscription,Loan Characteristics,Numeric,Actual amount of mortgage inscription for the loan,nan
AR95,Optional,static,Mortgage Mandate,Loan Characteristics,Numeric,Amount of mortgage mandate that can be converted into a proper mortgage at a later stage,nan
AR96,Optional,dynamic,Deed of Postponement?,Loan Characteristics,Y / N / ND,"If the loan is Right-to-Buy, whether a Deed of Postponement has been issued",A 'Y' would indicate that appropriate steps have been taken to ensure the lender's priority over the total loan amount
AR97,Mandatory,dynamic,Pre-payment Amount,Loan Characteristics,Numeric,Last pre-payment amount,Pre-payments definitions should be provided in the reporting glossary. Complete using non-negative numbers.
AR98,Optional,dynamic,Pre-payment Date,Loan Characteristics,Date,Last pre-payment date,nan
AR99,Optional,dynamic,Pre-payment Penalties,Loan Characteristics,Numeric,Cumulative amount of pre-payment penalties paid to date,nan
AR100,Mandatory,dynamic,Cumulative Pre-payments,Loan Characteristics,Numeric,Cumulative amount of pre-payments to date,Pre-payments definitions should be provided in the reporting glossary
AR101,Optional,dynamic,Amount of pre-payments allowed per year,Loan Characteristics,Numeric,Percentage amount of pre-payments allowed under the product per year. This is for mortgages that allow a certain threshold of pre-payments (i.e. 10%) before charges are incurred,"Percentage, to be reported in decimal format."
AR102,Mandatory,dynamic,Offset Savings Balance,Loan Characteristics,Numeric,"For offset mortgage products, this field must be completed with the offset savings balance for the linked account.",nan
AR103,Mandatory,static,Original Percentage Owned,Loan Characteristics,Numeric,"For shared ownership or shared equity products, the original percentage owned by the borrower must be populated in this field as a decimal (e.g. 50% should be shown as 0.50).","Percentage, to be reported in decimal format."
AR104,Mandatory,dynamic,Current Percentage Owned,Loan Characteristics,Numeric,"For shared ownership or shared equity products, the current percentage owned by the borrower must be populated in this field as a decimal (e.g. 50% should be shown as 0.50).","Percentage, to be reported in decimal format."
AR105,Mandatory,static,Help to Buy Scheme Type,Loan Characteristics,List,"For Help to Buy loans, the complete the field by selecting from the following list: Help to Buy 1 (Equity) (1) Help to Buy 2 (MIG) (2) Other (3) No or not applicable (4)",nan
AR106,,,Blank,Loan Characteristics,,nan,nan
AR107,Mandatory,static,Interest Rate Type,Interest Rate,List,"Interest rate type: Floating rate loan (for life) (1) Floating rate loan linked to Libor, Euribor, BoE reverting to the Bank's standard variable rate (SVR), ECB reverting to Bank’s SVR (2) Fixed rate loan (for life) (3) Fixed with future periodic resets (4) Fixed rate loan with compulsory future switch to floating (5) Capped (6) Discount (7) Other (8) No Data (ND)",Issuers should provide the applicable current rate
AR108,Mandatory,dynamic,Current Interest Rate Index,Interest Rate,List,Current interest rate index (the reference rate off which the mortgage interest rate is set): 1 month LIBOR (1) 1 month EURIBOR (2) 3 month LIBOR (3) 3 month EURIBOR (4) 6 month LIBOR (5) 6 month EURIBOR (6) 12 month LIBOR (7) 12 month EURIBOR (8) BoE Base Rate (9) ECB Base Rate (10) Standard Variable Rate (11) Other (12) No Data (ND),nan
AR109,Mandatory,dynamic,Current Interest Rate,Interest Rate,Numeric,Current interest rate (%).,"Percentage, to be reported in decimal format."
AR110,Mandatory,dynamic,Current Interest Rate Margin,Interest Rate,Numeric,"Current interest rate margin (for fixed rate loans this is the same as the current interest rate, for floating rate loans this is the margin over (or under if input as a negative) the index rate","Percentage, to be reported in decimal format."
AR111,Mandatory,dynamic,Interest Rate Reset Interval,Interest Rate,Numeric,The interval in months at which the interest rate is adjusted (for floating loans),nan
AR112,Mandatory,static,Interest Cap Rate,Interest Rate,Numeric,Interest rate cap (%).,"If the interest rate cap is linked to a floating rate (e.g.. BOE + 4%) then the current cap (i.e. taking into account the index) should be provided. Percentage, to be reported in decimal format."
AR113,Mandatory,dynamic,Interest Revision Date 1,Interest Rate,Date / ND,"Date interest rate next changes (e.g. discount margin changes, fixed period ends, loan re-fixed etc. this is not the next LIBOR reset date)",nan
AR114,Mandatory,dynamic,Revision Margin 2,Interest Rate,Numeric,The margin for the loan at the 2nd revision date,"Percentage, to be reported in decimal format."
AR115,Mandatory,dynamic,Interest Revision Date 2,Interest Rate,Date / ND,Date of 2nd interest rate change,nan
AR116,Mandatory,dynamic,Revision Margin 3,Interest Rate,Numeric,The margin for the loan at the 3rd revision date,"Percentage, to be reported in decimal format."
AR117,Mandatory,dynamic,Interest Revision Date 3,Interest Rate,Date / ND,Date of 3rd interest rate change,nan
AR118,Mandatory,dynamic,Revised Interest Rate Index,Interest Rate,List,Next interest rate index. Using codes as per field AR108,nan
AR119,Mandatory,dynamic,Revised Interest Rate Margin,Interest Rate,Numeric,Next interest rate margin,"Percentage, to be reported in decimal format."
AR120,Mandatory,static,Final Margin,Interest Rate,Numeric,The margin for the loan at the final step date,"Percentage, to be reported in decimal format."
AR121,Mandatory,static,Final Step Date,Interest Rate,Date,The date of the final margin adjustment,nan
AR122,Mandatory,static,Restructuring Arrangement,Interest Rate,Y / N / ND,Has the loan been restructured?,"A restructuring would include any change to the terms of the loan since it was added to the portfolio. This would include, for example, a maturity extension, a change to the required minimum monthly payments which is not the result of interest rate changes, a change to the repayment basis of the loan, arrears capitalisations etc. Details of the types of restructuring should be provided in the reporting glossary."
AR123,Mandatory,dynamic,Forbearance Type,Interest Rate,List,This field should be populated with Forbearance Type for loans currently subject to a forbearance arrangement. This field should be populated in conjunction with Restructuring Arrangement (AR122) and Performance Arrangement Date (AR173). With the following list type: Term extension (including maturity roll over for interest only loans) (1) Temporary transfer to IO (2) Permanent transfer to IO (3) Arrears capitalisation (4) Payment arrangement (5) Non contractual payment holiday (6) Other (7) Multiple forbearance options exercised (8) Not in forbearance (9),nan
AR124,,,Blank,Interest Rate,,nan,nan
AR125,,,Blank,Interest Rate,,nan,nan
AR126,,,Blank,Interest Rate,,nan,nan
AR127,,,Blank,Interest Rate,,nan,nan
AR128,Mandatory,static,Geographic Region,Property & Collateral,List,The region description of where the property is located.,This should be the International Territorial Levels (ITLs) 1 classification. See ONS Open Geography Portal for relevant choices.
AR129,Optional,static,Property Postcode ,Property & Collateral,Text,First 2 or 3 characters must be provided at a minimum. Do not supply the full postcode.,"For RMBS transactions, the Bank would accept the first 1 or 2 characters. For raw loan pools, the out-code is required. This must be a maximum of three characters, except where outcodes are four characters long."
AR130,Mandatory,static,Occupancy Type,Property & Collateral,List,Type of property occupancy: Owner-occupied (1) Partially owner-occupied (A property which is partly rented) (2) Non-owner-occupied/buy-to-let (3) Holiday/second home (4) No Data (ND),nan
AR131,Mandatory,static,Property Type,Property & Collateral,List,"Property type: Residential (House, detached or semi-detached) (1) Residential (Flat/Apartment) (2) Residential (Bungalow) (3) Residential (Terraced House) (4) Multifamily house (properties with more than four units securing one loan) with recourse to the borrower (5) Multifamily house without recourse to the borrower (6) Partially commercial use (property is used as a residence as well as for commercial use where less than 50% of its value derived from commercial use, e.g. doctor’s surgery and house) (7) Commercial/business use with recourse to the borrower (8) Commercial/business use without recourse to the borrower (9) Land Only (10) Other (11) No Data (ND)",nan
AR132,Optional,static,New Property,Property & Collateral,List,New property specifications: New build (1) Existing building (2) Other (3) No Data (ND),nan
AR133,Optional,static,Construction Year,Property & Collateral,Numeric,"Indicate the year when the property was originally built (YYYY format). In the case of a conversion of a building into flats, the date of conversion should be supplied","N.B, Year of construction, not full date."
AR134,Optional,static,Property Rating,Property & Collateral,Text / ND,Internal rating of property or credit scoring of property,nan
AR135,Mandatory,static,Original Loan to Value,Property & Collateral,Numeric,Originator’s original underwritten Loan To Value ratio (LTV). For 2nd lien loans this should be the combined or total LTV.,"Percentage, to be reported in decimal format."
AR136,Mandatory,static,Valuation Amount,Property & Collateral,Numeric,Property value as of date of latest loan advance prior to a securitisation. Valuation amounts should be in the same currency as the loan (field AR65).,"For portfolios of raw loans, this should be the valuation amount at the last full valuation (not indexed)."
AR137,Mandatory,static,Original Valuation Type,Property & Collateral,List,"Valuation type at origination: Full, internal and external inspection (1) Full, only external inspection (2) Drive-by (3) AVM (flag as AVM only if this type of valuation has been used for origination purposes) (4) Indexed (5) Desktop (6) Managing Agent / Estate Agent (7) Tax Authority (8) Other (9) No Data (ND)",AR137-AR138 should relate to the valuation amount provided at AR136. Such valuation can be either as at origination or as at the most recent advance date. Details of what is being computed should be detailed in the glossary
AR138,Mandatory,static, Valuation Date,Property & Collateral,Date,Date of latest property valuation at time of latest loan advance prior to a securitisation.,AR137-AR138 should relate to the valuation amount provided at AR136. For RMBS securitisations: such valuation can be either as at origination or as at the most recent advance date. Details of what is being computed should be detailed in the glossary.
AR139,Optional,static,Confidence Interval for Original Automated Valuation Model Valuation,Property & Collateral,Numeric,Confidence interval for original valuation if valuation method is Automated Valuation Model (AVM),"Percentage, to be reported in decimal format."
AR140,Optional,static,Provider of Original Automated Valuation Model Valuation,Property & Collateral,Text / ND,Name of Automated Valuation Model (AVM) provider if original valuation method is AVM,nan
AR141,Mandatory,dynamic,Current Loan to Value,Property & Collateral,Numeric,Originator’s current Loan to Value ratio (LTV). For 2nd lien loans this should be the combined or total LTV,"Percentage, to be reported in decimal format."
AR142,Optional,Static,Purchase Price,Property & Collateral,Numeric,Original purchase price of the property. If no data available specify as No Data (ND).,nan
AR143,Mandatory,dynamic,Current Valuation Amount,Property & Collateral,Numeric ,"Most recent valuation amount (if e.g. at repossession there were multiple valuations, this should reflect the lowest). If no update, specify as No Data (ND). Valuation amounts should be in the same currency as the loan (field AR65)",nan
AR144,Mandatory,dynamic,Current Valuation Type,Property & Collateral,List,"Valuation type at origination: Full, internal and external inspection (1) Full, only external inspection (2) Drive-by (3) AVM (flag as AVM only if this type of valuation has been used for origination purposes) (4) Indexed (5) Desktop (6) Managing Agent / Estate Agent (7) Tax Authority (8) Other (9) No Data (ND)",The latest valuation type applicable to the valuation provided in field AR143 should be provided
AR145,Mandatory,dynamic,Current Valuation Date,Property & Collateral,Date,The date of most recent valuation,nan
AR146,Optional,dynamic,Confidence Interval for Current Automated Valuation Model Valuation,Property & Collateral,Numeric,List the Automated Valuation Model (AVM) supplier's confidence value for the most recent valuation,"Percentage, to be reported in decimal format."
AR147,Optional,dynamic,Provider of Current Automated Valuation Model Valuation,Property & Collateral,Text,Name of Automated Valuation Model (AVM) provider if current valuation method is AVM,nan
AR148,Optional,dynamic,Property Value at Time of Latest Loan Advance,Property & Collateral,Numeric,Property value at the time of the last advance. Valuation amounts should be in the same currency as the loan (field AR65),nan
AR149,Optional,static,Indexed Foreclosure Value,Property & Collateral,Numeric / ND,"The foreclosure value of the property, including indexation. If no data available state No Data (ND)",Name of index used should be detailed in the glossary
AR150,Optional,static,Ipoteca,Property & Collateral,Numeric / ND,The ipoteca value of the property. If no data available state No Data (ND),nan
AR151,Optional,static,Date of Sale,Property & Collateral,Date,The date of sale of the foreclosed property,nan
AR152,Optional,static,Additional Collateral,Property & Collateral,List,Type of additional collateral: Savings Balance (1) Life Insurances (2) Investments (3) Pledged Properties (4) Other (5) No Data (ND),nan
AR153,Optional,static,Additional Collateral Provider,Property & Collateral,Text,Provider of additional collateral (i.e. bank or insurance company),nan
AR154,Mandatory,static,Gross Annual Rental Income,Property & Collateral,Numeric,Gross Annual Rental income for Buy To Let (BTL) properties,Only mandatory for Buy-to-let mortgages
AR155,Mandatory,static,Number of Buy to Let Properties,Property & Collateral,Numeric,"Total number of properties in portfolio, including those mortgaged with other lenders (BTL loans only)","Only mandatory for Buy-to-let mortgages, to the extent captured"
AR156,Mandatory,static,Debt Service Coverage Ratio,Property & Collateral,Text/Numeric,For Buy to Lets the Debt Service Coverage Ratio (DSCR) - Monthly Gross Rental Income divided by the Mortgage Payment For borrowers the DSCR is the Monthly Income divided by the Mortgage Payment.,Only mandatory for Buy-to-let mortgages
AR157,Optional,dynamic,Additional Collateral Value,Property & Collateral,Numeric,Value of additional collateral,nan
AR158,Optional,dynamic,Real Estate Owned,Property & Collateral,Y / N / ND,Is the property owned by the Structure / Fund,nan
AR159,Optional,static,Is Property Transferability Limited,Property & Collateral,Y / N / ND,"For Officially-sponsored Housing (Spanish initials, Vivienda de Protección Oficial (VPO) loans, whether the property transferability is limited",nan
AR160,Optional,dynamic,Time Until Declassification,Property & Collateral,Numeric,"For Spanish Vivienda de Protección Oficial (VPO) loans, time (in months) until property will be declassified as VPO property",nan
AR161,,,Blank,Property & Collateral,,nan,nan
AR162,Mandatory,dynamic,Current Energy Performance Certificate Value ,Property & Collateral,List,Latest current Energy Performance Certificate (EPC) rating for the property: Energy Performance Certificate A (A) Energy Performance Certificate B (B) Energy Performance Certificate C (C) Energy Performance Certificate D (D) Energy Performance Certificate E (E) Energy Performance Certificate F (F) Energy Performance Certificate G (G) Confirmed that property is not required to have EPC rating (NR) Unknown / no data (ND),"Please do not submit any ‘modelled’ EPC ratings information. EPC ratings information should be either based on information provided at the time of underwriting, or the public EPC databases for properties in England, Wales, and Northern Ireland or Scotland. In cases where you cannot obtain data and know that the property is not required to have an EPC rating (eg because the property was bought before 2008) please select ‘NR’ (No Rating). In cases where you cannot obtain data but are unable to confirm that the property is not required to have an EPC rating please select ‘ND’ (No Data)."
AR163,Mandatory,dynamic,Potential Energy Performance Certificate Value ,Property & Collateral,List,Latest potential Energy Performance Certificate (EPC) rating for the property: Energy Performance Certificate A (A) Energy Performance Certificate B (B) Energy Performance Certificate C (C) Energy Performance Certificate D (D) Energy Performance Certificate E (E) Energy Performance Certificate F (F) Energy Performance Certificate G (G) Confirmed that property is not required to have EPC rating (NR) Unknown / no data (ND),"Please do not submit any ‘modelled’ EPC ratings information. EPC ratings information should be either based on information provided at the time of underwriting, or the public EPC databases for properties in England, Wales, and Northern Ireland or Scotland. In cases where you cannot obtain data and know that the property is not required to have an EPC rating (eg because the property was bought before 2008) please select ‘NR’ (No Rating). In cases where you cannot obtain data but are unable to confirm that the property is not required to have an EPC rating please select ‘ND’ (No Data)."
AR164,Mandatory,dynamic,Exemption from Energy Efficiency Regulation,Property & Collateral,Y / ND,Flag if you can confirm that a property benefits from the exemptions in Chapter 4 of 'The Energy Efficiency (Private Rented Property) (England and Wales) Regulations 2015'.,Only select 'Y' (Yes) to the extent that you can confirm that a property benefits from the exemptions in Chapter 4 of 'The Energy Efficiency (Private Rented Property) (England and Wales) Regulations 2015'. In all other cases you should select ‘ND’ (No data). This includes cases where the property is not subject to the regulationn.
AR165,,,Blank,Property & Collateral,,nan,nan
AR166,Mandatory,dynamic,Account Status,Performance,List,Current status of account: Performing (1) Arrears (2) Default or Foreclosure (3) Redeemed (4) Repurchased by Seller (5) Other (6) No Data (ND),Loans with any arrears greater than £0.00 should be marked as status '2'. Those in a performing forbearance arrangement but with uncleared arrears outstanding should remain classified as '2'.
AR167,Optional,dynamic,Date Last Current,Performance,Date,"If the borrower is in arrears, the date they were last current",nan
AR168,Optional,dynamic,Date Last in Arrears,Performance,Date / ND,Date the borrower was last in arrears. If the borrower is current the date they were last in arrears. If no data available specify No Data (ND),nan
AR169,Mandatory,dynamic,Arrears Balance,Performance,Numeric,Current balance of arrears. Arrears defined as: Total payments due to date LESS Total payments received to date LESS any amounts capitalised. This should not include any fees applied to the account,Issuers should provide the definition of 'arrears' in the reporting glossary. Arrears balances should be shortfalls in the accumulated total payments actually made by the customer measured against the accumulated total amount of payments due. This should not be restricted to FCA 'reportable arrears' of those greater than 2.5% balance. This field should not be populated with Pre-Payments. Complete using non-negative numbers.
AR170,Mandatory,dynamic,Number Months in Arrears,Performance,Numeric,Number of months this loan is in arrears (at pool cut off date) according to the definition of the issuer,"This should be defined as the number of monthly payment shortfalls. For example one full missed payment that occurred six months ago is 1m in arrears not 6m. Where possible fractions should also be reported in decimal format, for example to identify those in arrears but less than 1m."
AR171,Mandatory,dynamic,Arrears 1 Month Ago,Performance,Numeric,Arrears balance (defined as per ‘arrears balance’) for the previous month,Arrears balances should be shortfalls in the accumulated total payments actually made by the customer measured against the accumulated total amount of payments due. This should not be restricted to FCA 'reportable arrears' of those greater than 2.5% balance.
AR172,Mandatory,dynamic,Arrears 2 Months Ago,Performance,Numeric,Arrears balance (defined as per ‘arrears balance’) two months ago,Arrears balances should be shortfalls in the accumulated total payments actually made by the customer measured against the accumulated total amount of payments due. This should not be restricted to FCA 'reportable arrears' of those greater than 2.5% balance.
AR173,Mandatory,dynamic,Performance Arrangement,Performance,Date,The date when the borrower had an arrangement put in place to reduce the balance of any arrears whilst maintaining their current payment. If no data available specify No Data (ND).,A performance arrangement would be considered as any change to the terms of the loan as detailed in AR122 and AR123.
AR174,Mandatory,dynamic,Litigation,Performance,Y / N / ND,Flag to indicate litigation proceedings underway (if account has recovered and is no longer being actively litigated this should be re-set to N),nan
AR175,Mandatory,dynamic,Redemption Date,Performance,Date,Date on which account redeemed,"The Bank will require information on redeemed mortgages continues to be reported for one reporting period. If accounts are removed from the assigned portfolio on redemption, Issuers may wish to remove them from reporting after this period"
AR176,Optional,dynamic,Months in Arrears Prior,Performance,Numeric,Number of months in arrears at month end prior to redemption. This is to capture the arrears amount prior to the mortgage redeeming,nan
AR177,Mandatory,dynamic,Default or Foreclosure,Performance,Numeric,Total default amount before the application of sale proceeds and recoveries.,nan
AR178,Mandatory,dynamic,Date of Default,Performance,Numeric,The date of default or foreclosure.,nan
AR179,Mandatory,dynamic,Sale Price,Performance,Numeric,Price achieved on sale of property in case of foreclosure,nan
AR180,Mandatory,dynamic,Loss on Sale,Performance,Numeric,"Total loss net of fees, accrued interest etc. after application of sale proceeds (excluding prepayment charge if subordinate to principal recoveries). Show any gain on sale as a negative number",Gain on sale only applicable to the extent transaction benefits from such gain.
AR181,Mandatory,dynamic,Cumulative Recoveries,Performance,Numeric,Cumulative recoveries – only relevant for cases with losses,Recoveries payable to Issuer should be reported here
AR182,Optional,dynamic,Professional Negligence Recoveries,Performance,Numeric,"Any amounts received in settlement or as a result of professional negligence claims against surveyors, solicitors etc. net of any fees / costs",nan
AR183,Optional,dynamic,Loan flagged as Contencioso,Performance,Y / N / ND,Flag to identify if borrower has entered 'Contencioso' status. Applicable only in Spain,nan
AR184,,,Blank,Performance,,nan,nan
AR185,,,Blank,Performance,,nan,nan
AR186,,,Blank,Performance,,nan,nan
AR187,,,Blank,Performance,,nan,nan
AR188,,,Blank,Performance,,nan,nan
AR189,Mandatory,static,Second Borrower's Employment Status,Borrower Information,List,"Employment status of the primary applicant: Employed or full loan is guaranteed (1) Employed with partial support (company subsidy) (2) Protected life-time employment (Civil/government servant) (3) Unemployed (4) Self-employed (5) No employment, borrower is legal entity (6) Student (7) Pensioner (8) Other (9) No Data (ND)",In relation to the secondary borrower and latest available information
AR190,Optional,static,Class of Second Borrower,Borrower Information,Text,Class of borrower based on credit scoring or other classification,Relevant to secondary borrower only. List of class definitions used to be explained in the reporting glossary
AR191,Optional,static,Resident (Second Borrower),Borrower Information,List,Whether borrower is resident of the country: Resident less than 3 years (1) Resident >= 3 years (2) Not Resident (3) No Data (ND),Relevant to secondary borrower only
AR192,Mandatory,static,Number of County Court Judgements or equivalent  - Satisfied (Second Borrower),Borrower Information,Numeric,Number of County Court Judgements (CCJs) or equivalent in particular jurisdiction (typically a default or court proceedings flag in continental Europe) - recorded against the primary borrower that were satisfied (the balance cleared) at time of underwriting,Relevant to secondary borrower only. Either field AR192 or AR193 can be provided if both are not available
AR193,Mandatory,static,Value of County Court Judgements or equivalent - Satisfied  (Second Borrower),Borrower Information,Numeric,Total value of CCJs or equivalent recorded against the primary borrower that were satisfied at time of underwriting,Relevant to secondary borrower only. Either field AR192 or AR193 can be provided if both are not available
