FieldNumber,Priority,TAG,FieldName,Category,DataType,Definition,Guidance
AR1,Mandatory,dynamic,Pool Cut-off Date,Core,Date,Pool or Portfolio cut-off date. All dates take DD-MM-YYYY format.,"Populate with the ‘run date’ i.e. the date at which data was produced, not the date of submission to the Bank."
AR2,Mandatory,static,Pool Identifier,Core,Text/Numeric,Pool or Portfolio identifier / name of transaction.,"An identifier for each portfolio of loans sold into the transaction. In the case of raw loan pools, this must only be populated with the Pool ISIN supplied by the Bank of England."
AR3,Mandatory,static,Loan Identifier,Core,Text/Numeric,"Unique identifier (ID) for each loan. The loan ID should not change through the life of the transaction. If the original loan ID cannot be maintained in this field enter the original ID followed by the new ID, comma delimited.","Loan identifiers should be consistent across portfolios of the same originator in the event loans are moved between portfolios. Each unique loan identifier must be on a separate row, and a unique identifier must be used for every loan. For further loan advances the original loan identifier must be prefixed sequentially, for example; 100-1 on the first row, 100-2 on the second row. Numeric identifiers are limited to 15 characters, whereas alphanumeric identifiers are not. Where multiple borrowers are party to a loan, only individual IDs must be less than 15 characters - identifiers separated by commas or semi colons will be read as separate IDs."
AR4,Optional,static,Regulated Loan,Core,Y / N / ND,Indication if the loan is regulated (Y) or not. This is to indicate a loan regulated by the consumer credit act in the UK or equivalent in continental Europe.,Only loans regulated by the Consumer Credit Act in the UK should be designated as 'Y'
AR5,Mandatory,static,Originator,Core,Text,Lender that advanced the original loan.,nan
AR6,Mandatory,static,Servicer Identifier,Core,Text/Numeric,Unique identifier per servicer to flag which entity is servicing the loan.,"If multiple servicers are being used, clarification should be provided in the reporting glossary. Numeric identifiers are limited to 15 characters, whereas alphanumeric identifiers are not. Where multiple borrowers are party to a loan, only individual IDs must be less than 15 characters - identifiers separated by commas or semi colons will be read as separate IDs. These ID fields must be unique e.g. a single ID per individual borrower."
AR7,Mandatory,static,Borrower Identifier,Core,Text/Numeric,Unique identifier (ID) per borrower (not showing the real name) - to enable borrowers with multiple loans in the pool to be identified (e.g. further advances / second liens are shown as separate entries). Should not change over the life of the transaction. If more than one borrower list the Borrower ID's comma delimited with primary borrower first.,"Numeric identifiers are limited to 15 characters, whereas alphanumeric identifiers are not. These ID fields must be unique e.g. a single ID per individual borrower. Where multiple borrowers are party to a loan, only individual IDs must be less than 15 characters. Multiple identifiers should be separated by commas or semi colons. Where multiple loans or properties exist at the account level, the borrower identifier must be repeated on multiple rows. This includes further advances."
AR8,Mandatory,static,Property Identifier,Core,Text/Numeric,Unique identifier per property to enable properties with multiple loans in the pool to be identified (e.g. further advances / second liens are shown as separate entries).,"Each unique property identifier must be on a separate row, and a unique identifier must be used for every property. Numeric identifiers are limited to 15 characters, whereas alphanumeric identifiers are not. Where multiple borrowers are party to a loan, only individual IDs must be less than 15 characters - identifiers separated by commas or semi colons will be read as separate IDs."
AR9,,,Blank,Core,,nan,nan
AR10,,,Blank,Core,,nan,nan
AR11,,,Blank,Core,,nan,nan
AR12,,,Blank,Core,,nan,nan
AR13,,,Blank,Core,,nan,nan
AR14,,,Blank,Core,,nan,nan
AR15,Optional,static,Borrower Type,Borrower Information,List,The type of borrower IND - individual COM - commercial SCI - Société Civile Immobilière ND - No Data,nan
AR16,Optional,static,Foreign National,Borrower Information,Y / N / ND,Indicating whether the borrower is a national of the country in which the property and mortgage loan resides.,nan
AR17,Optional,static,Borrower Credit Quality,Borrower Information,Text,Originators own definition of borrower credit quality Free text using originator own terms ND - No Data,"Consistent terminology (e.g.. prime, sub-prime, etc.) should be used by each Issuer with definitions / explanations provided in the reporting glossary"
AR18,Optional,static,Borrower Year of Birth,Borrower Information,Date,Borrower year of birth. YYYY format.,"Refers to the primary borrower. N.B. Year of birth, not full date."
AR19,Mandatory,static,Number of Debtors,Borrower Information,Numeric,Number of borrowers to the loan,"This template provides space for information on up to 2 borrowers to a loan. To the extent that there are more borrowers than this, further information should be provided on AR20, AR26-27, AR189-AR210 and AR221-AR234 and AR236."
AR20,Optional,static,Second Applicant Year of Birth,Borrower Information,Date,Second applicant year of birth. YYYY format.,"Consistent with field AR18, only the year of birth of the secondary borrower should be completed. N.B. Year of birth, not full date."
AR21,Mandatory,static,Borrower's Employment Status,Borrower Information,List,"Employment status of the primary applicant: Employed or full loan is guaranteed (1) Employed with partial support (company subsidy) (2) Protected life-time employment (Civil/government servant) (3) Unemployed (4) Self-employed (5) No employment, borrower is legal entity (6) Student (7) Pensioner (8) Other (9) No Data (ND)",In relation to the primary borrower
AR22,Optional,static,First-time Buyer ,Borrower Information,Y / N / ND,First time buyer flag,"Relates to primary borrower. To the extent this designation is made on a loan, not borrower, basis, please note this in the glossary"
AR23,Optional,static,Right to Buy,Borrower Information,Y / N / ND,Right to Buy (RTB) flag,nan
AR24,Optional,static,Right to Buy Price,Borrower Information,Numeric,Purchase price of RTB property,If the loan is classified on the lender's system as a right-to-buy
AR25,Optional,static,Class of Borrower,Borrower Information,Text,Class of borrower based on credit scoring or other classification,List of class definitions used to be explained in the reporting glossary
AR26,Mandatory,static,Primary Income,Borrower Information,Numeric,Primary borrower underwritten gross annual income (not rent),"Where there is more than one borrower but only joint income is recorded, the joint income should be entered as the 'Primary Income' (AR26) and 'Secondary Income' (AR28) should be zero"
AR27,Mandatory,static,Income Verification for Primary Income,Borrower Information,List,Income verification for primary income: Self-certified no checks (1) Self-certified with affordability confirmation (2) Verified (3) Non-Verified Income (4) Other (5) No Data (ND),nan
AR28,Mandatory,static,Secondary Income,Borrower Information,Numeric,Secondary borrower underwritten gross annual income (not rent – if single borrower then 0). When there are more than two borrowers indicate total annual combined income,"Where there is more than one borrower but only joint income is recorded, the joint income should be entered as the 'Primary Income' (AR26) and 'Secondary Income' (AR28) should be zero"
AR29,Mandatory,static,Income Verification for Secondary Income,Borrower Information,List,Income verification for secondary income: Self-certified no checks (1) Self-certified with affordability confirmation (2) Verified (3) Non-Verified Income (4) Other (5) No Data (ND),nan
AR30,Optional,static,Resident,Borrower Information,List,Whether borrower is resident of the country: Resident less than 3 years (1) Resident >= 3 years (2) Not Resident (3) No Data (ND),nan
AR31,Mandatory,static,Number of County Court Judgements or equivalent  - Satisfied,Borrower Information,Numeric,Number of County Court Judgements (CCJs) or equivalent in particular jurisdiction (typically a default or court proceedings flag in continental Europe) - recorded against the primary borrower that were satisfied (the balance cleared) at time of underwriting,Relates to primary borrower only. Either field AR31 or AR32 can be provided if both are not available
AR32,Mandatory,static,Value of County Court Judgements or equivalent - Satisfied,Borrower Information,Numeric,Total value of CCJs or equivalent recorded against the primary borrower that were satisfied at time of underwriting,Relates to primary borrower only. Either field AR31 or AR32 can be provided if both are not available
AR33,Mandatory,static,Number of County Court Judgements or equivalent - Unsatisfied,Borrower Information,Numeric,Number of CCJs or equivalent recorded against the primary borrower that were unsatisfied at time of underwriting,Relates to primary borrower only. Either field AR33 or AR34 can be provided if both are not available
AR34,Mandatory,static,Value of County Court Judgements or equivalent - Unsatisfied,Borrower Information,Numeric,Total value of CCJs or equivalent recorded against the primary borrower that were unsatisfied at time of underwriting,Relates to primary borrower only. Either field AR33 or AR34 can be provided if both are not available
AR35,Optional,static,Last County Court Judgements or equivalent – Date,Borrower Information,Date / ND,Date last CCJ or equivalent was registered against the primary borrower regardless of satisfied or not,Relates to primary borrower only Date does not have to correspond to the CCJs reported in AR31-34 if there has been a new CCJ since the time of underwriting
AR36,Mandatory,dynamic,Bankruptcy or Individual Voluntary Arrangement Flag,Borrower Information,Y / N / ND,Flag to identify if borrower has been bankrupt or had an Individual Voluntary Arrangement (IVA) or equivalent.,"Relates to primary borrower only. To be updated on a monthly basis. If updated Bankruptcy data are not regularly collected, BoE does not expect you to start collecting this. However, where data are available or you are notified of a borrower bankruptcy, this should be reported in the relevant fields."
AR37,Optional,static,Bureau Krediet Registratie 1 to 10 - Credit Type,Borrower Information,List,Credit type according to the coding of Bureau Krediet Registratie (BKR) (Netherlands only) AK - Loans which have to pay back in a predefined period RK - Loans with a maximum credit amount SR - Loan with the aim to re-arrange previous credits VK - Credit maximum with respect to goods ordered with mail-order companies HY - mortgage loans TC - telecom credits RO - Other credit ND - No Data,Relates to primary borrower only
AR38,Optional,static,Bureau Krediet Registratie 1 to 10- Registration Date,Borrower Information,Date,Registration date of the BKR,Relates to primary borrower only
AR39,Optional,static,Bureau Krediet Registratie 1 to 10 - Arrears Code,Borrower Information,List,Arrears code according to the coding of Bureau Krediet Registratie (BKR) (Netherlands only) A - arrears AH - arrears repaid A1 - settlement reached A2 - remaining outstanding is summoned A3 - an amount > Euro 250 is depreciated A4 - person disappeared ND - No Data,Relates to primary borrower only
AR40,Optional,static,Bureau Krediet Registratie 1 to 10 - Credit Amount,Borrower Information,Numeric,Amount of the credit (Netherlands only),Relates to primary borrower only
AR41,Optional,static,Bureau Krediet Registratie 1 to 10 - Is Coding Cured?,Borrower Information,Y / N / ND,Is the coding with BKR cured? (Netherlands only),Relates to primary borrower only
AR42,Optional,static,Bureau Krediet Registratie 1 to 10 - Number of Months Since Cured,Borrower Information,Numeric,"If the coding is cured, number of months since it is cured (Netherlands only)",Relates to primary borrower only
AR43,Mandatory,dynamic,Bureau Score Provider,Borrower Information,List,Who has provided the score. For continental Europe give name of provider: Callcredit (1) Experian (2) Equifax (3) Schufa (4) Bureau Krediet Registratie (BKR) (5) Internal Score (6) Other (7) No Data (ND),Relates to primary borrower only
AR44,Mandatory,dynamic,Bureau Score Type,Borrower Information,List,Type of scorecard provided: Generation 8 B&F AAM - DCM (Experian) (1) Generation 8 B&F CRS - DCM (Experian) (2) Generation 7 Mortgage PD Score - DCM (Experian) (3) FSC109 - Risk Navigator (Equifax) (4) RNILF02 - Risk Navigator (Equifax) (5) RNISF02 - Risk Navigator (Equifax) (6) Internal Scorecard (7) Other (8) No Data (ND),Relates to primary borrower only
AR45,Mandatory,dynamic,Bureau Score Date,Borrower Information,Date,The date of the bureau score for this borrower,Relates to primary borrower only. Should be the date on which the most recent score was provided
AR46,Mandatory,dynamic,Bureau Score Value,Borrower Information,Text/Numeric,Borrower's score: >0 Regular Score -999 CAIS for mortgage not available -998 Notice of Correction or Notice of Dispute 0 Bankruptcy Restriction Order or Bankruptcy Restriction Undertaking ND - No Data,Relates to primary borrower only. Should be the most recent score provided
AR47,Optional,static,Prior Repossessions,Borrower Information,Y / N / ND,Indicator of prior repossessions resulting from a borrower defaulting on a previous mortgage loan,Relates to primary borrower only
AR48,Optional,static,Previous Mortgage Arrears 0-6 Months,Borrower Information,Numeric / ND,Number of payments missed on previous mortgage in the prior 0-6 months (information as at underwriting). If no data available specify No Data (ND),Relates to primary borrower only
AR49,Optional,static,Previous Mortgage Arrears 6+ Months,Borrower Information,Numeric / ND,"Number of payments missed on previous mortgage in the prior months, greater or equal than 6 months (information as at underwriting) If no data available specify No Data (ND)",Relates to primary borrower only
AR50,Optional,dynamic,Internal Rating,Borrower Information,Text/Numeric,"Populate with data on the Bank Internal Rating, the one year PD.",This is requested on a ‘comply or explain basis’ – noting this may not be available for those not on IRB.
AR51,,,Blank,Borrower Information,,nan,nan
AR52,,,Blank,Borrower Information,,nan,nan
AR53,,,Blank,Borrower Information,,nan,nan
AR54,,,Blank,Borrower Information,,nan,nan
AR55,Mandatory,static,Loan Origination Date,Loan Characteristics,Date,Date of original loan advance,"For RMBS securitisations, quarter of origination should be used. For portfolios of raw loans, full date should be reported."
AR56,Mandatory,dynamic,Date of Loan Maturity,Loan Characteristics,Date,The date of loan maturity,nan
AR57,Mandatory,static,Account Status Date,Loan Characteristics,Date,Date which account came into securitised portfolio (important for replenishable pools),The date on which the loan was sold into the portfolio
AR58,Mandatory,static,Origination Channel / Arranging Bank or Division,Loan Characteristics,Text,"Origination channel, arranging bank or division for the loan: Office / branch network (1) Central / Direct (2) Broker (3) Internet (4) Packager (5) No Data (ND)",nan
AR59,Mandatory,static,Purpose,Loan Characteristics,List,Loan purpose. Permissible answers: Purchase (1) Re-mortgage (2) Renovation (3) Equity release (4) Construction (5) Debt consolidation (6) Other (7) Re-mortgage with Equity Release (8) Re-mortgage on Different Terms (9) Combination Mortgage (10) Investment Mortgage (11) Right to Buy (12) Government Sponsored Loan (13) SCPI (14) Besson (15) Perissol (16) DOM (Défiscalisation Métrople) (17) Other (18) No Data (ND),If the loan purpose could be classified in more than one category (e.g.. an investment mortgage could be a re-mortgage or a debt consolidation) the Issuer may choose the field considered most relevant to the loan or add to the list and provide clarification in the reporting glossary
AR60,Mandatory,static,Shared Ownership,Loan Characteristics,List,Shared Ownership flag: Not Shared Ownership (1) Central Government Scheme (2) Local Government Scheme (3) Housing Associations (4) Building Developers (5) Other (6) No Data (ND),"This field is now mandatory and should be completed for all pools. In addition, list types 2-6 should be completed for Shared Equity loans."
AR61,Mandatory,static,Loan Term,Loan Characteristics,Numeric,Original contractual term (number of months),nan
AR62,Optional,static,Principal Grace Period,Loan Characteristics,Numeric,"Period, in months, from the origination date of the loan during which only interest and no principal is payable. After this period the loan switches to both interest and principal payments. If no data available specify No Data (ND)",nan
AR63,Optional,static,Amount Guaranteed,Loan Characteristics,Numeric,The amount of loan guaranteed If no data available specify No Data (ND),nan
AR64,Optional,static,Subsidy,Loan Characteristics,Y/N,Is the loan repayment subsidised by an external party? If no data available specify No Data (ND),nan
AR65,Mandatory,static,Loan Currency Denomination ,Loan Characteristics,Text/Numeric,Loan currency denomination: EUR (1) GBP (2) USD (3) ANG (4) BGN (5) CYP (6) CZK (7) DKK (8) EEK (9) HUF (10) LTL (11) LVL (12) MTL (13) PLN (14) RON (15) SEK (16) No Data (ND),nan
AR66,Mandatory,static,Original Balance,Loan Characteristics,Numeric,Original loan balance (inclusive of fees),"To the extent original balance does not include fees this would be considered acceptable, though the reporting glossary should make this clear"
AR67,Mandatory,dynamic,Current Balance,Loan Characteristics,Numeric,"Amount of loan outstanding as of pool cut off date, This should include any amounts that are secured by the mortgage and will be classed as principal in the transaction. For example if fees have been added to the loan balance and are part of the principal in the transaction these should be added. Excluding any interest arrears or penalty amounts.","For portfolios of raw loans: this should include any amounts that are secured by the mortgage and will be classed as principal. For example if fees have been added to the loan balance and are part of the principal in the transaction these should be added. It should exclude any interest arrears or penalty amounts. For RMBS securitisations: to the extent original balance does not include fees this would be considered acceptable, though the reporting glossary should make this clear."
AR68,Optional,static,Fractioned / Subrogated Loans,Loan Characteristics,Text / ND,Mortgage loans first taken out by the real estate developer and then “split” into new individual owners. If no data available specify No Data (ND),nan
AR69,Mandatory,static,Repayment Method,Loan Characteristics,List,Type of principal repayment: Interest Only (1) Repayment (2) Endowment (3) Pension (4) ISA/PEP (5) Index-Linked (6) Part & Part (7) Savings Mortgage (8) Other (9) No Data (ND),If the repayment method could be classified in more than one category the Issuer should choose the field considered most relevant to the loan or add to the list and provide clarification of the additional classifications in the reporting glossary
AR70,Mandatory,static,Payment Frequency,Loan Characteristics,List,"Frequency of payments due, i.e. number of months between payments: Monthly (1) Quarterly (2) Semi annually (3) Annual (4) Bullet (5) Other (6) No Data (ND)",nan
AR71,Mandatory,dynamic,Payment Due,Loan Characteristics,Numeric,Periodic contractual payment due (the payment due if there are no other payment arrangements in force),nan
AR72,Mandatory,static,Payment Type,Loan Characteristics,List,Principal payment type: Annuity (1) Linear (2) Increasing instalments (3) Fixed instalments (changing maturity) with structural protection (4) Fixed instalments (changing maturity) without structural protection (5) Bullet (6) Bullet + Savings deposit (7) Bullet + Life insurance (8) Bullet + Investment portfolio (9) Bi-annual (10) Tri-annual (11) Offset mortgage (12) Other (13) No Data (ND),nan
AR73,Optional,static,Debt to Income,Loan Characteristics,Numeric,"Debt to Income (DTI) ratio with definition and calculation. For combined income. Debt defined as the Amount of loan outstanding as of pool cut off date, This should include any amounts that are secured by the mortgage and will be classed as principal in the transaction. For example if fees have been added to the loan balance and are part of the principal in the transaction these should be added. Excluding any interest arrears or penalty amounts. Income defined as combined income, sum of primary and secondary income fields (field numbers 34 and 35)","This should be the combined debt to income ratio as at origination of the loan. Percentage, to be reported in decimal format."
AR74,Optional,static,Type of Guarantee Provider,Loan Characteristics,List,"Indicate guarantee provider, if applicable: No Guarantor (1) Individual - Family Relation (2) Individual - Other (3) Government (4) Bank (5) Insurance Product (6) Nationale Hypotheek Garantie (NHG) Guarantee Scheme (Netherlands) (7) Fonds de Garantie de l'Accession Sociale (FGAS) (8) Caution (France) (9) Other (10) No Data (ND)",nan
AR75,Optional,static,Guarantee Provider,Loan Characteristics,Text,Name of guarantee provider,nan
AR76,Optional,static,Income Guarantor,Loan Characteristics,Numeric,Income of guarantor of borrower (e.g. income of parents if co-signed),nan
AR77,Optional,dynamic,Subsidy Received,Loan Characteristics,Numeric,Amount of subsidy received from government by borrower,"Any subsidy provided by a third party should be included in this field, with details of the party providing the subsidy explained in the reporting glossary"
AR78,Mandatory,static,Mortgage Indemnity Guarantee Provider,Loan Characteristics,Text,Name of Mortgage Indemnity Guarantee (MIG) provider if applicable,Mandatory where applicable (i.e.. if the underlying mortgage benefits from a MIG and that benefit is sold into the transaction). Mandatory for Help to Buy loans.
AR79,Mandatory,static,Mortgage Indemnity Guarantee Attachment Point,Loan Characteristics,Numeric,MIG attachment point - LTV percentage above which losses are insured,Mandatory where applicable (i.e.. if the underlying mortgage benefits from a MIG and that benefit is sold into the transaction). Mandatory for Help to Buy loans.
AR80,Optional,dynamic,Prior Balances,Loan Characteristics,Numeric,Total balances ranking prior to this loan (including those held with other lenders),nan
AR81,Optional,dynamic,Other Prior Balances,Loan Characteristics,Numeric,Total balance ranking prior to this loan held with other lenders (sub-set of Prior Balances),nan
AR82,Optional,dynamic,Pari Passu Loans,Loan Characteristics,Numeric,Total value of loans ranking pari passu with loan (not included in this pool),nan
AR83,Optional,dynamic,Subordinated Claims,Loan Characteristics,Numeric,Total value of loans with claims subordinated to this loan (not in this pool),nan
AR84,Mandatory,static,Lien,Loan Characteristics,List,Seniority on liquidation of property: 1st Lien (1) 2nd Lien (2) 3rd Lien (3) Other (4) No Data (ND),nan
AR85,Optional,dynamic,Retained Amount,Loan Characteristics,Numeric,"Amount the Issuer will be obliged to fund to the borrower at a later date, for example construction deposit",nan
AR86,Optional,dynamic,Retained Amount Date,Loan Characteristics,Date,"Date when the retained amount is to be drawn by. If available until the maturity date, enter the maturity date here.",nan
AR87,Mandatory,dynamic,Maximum Balance,Loan Characteristics,Numeric,For loans with flexible re-draw facilities – the maximum loan amount that could potentially be outstanding i.e. Current Balance adjusted for flexible features or committed further lending (reunderwritten further advances are not within scope).,Use AR90.
AR88,Mandatory,dynamic,Further Loan Advance,Loan Characteristics,Numeric,"Total value of further advances made on loan. If several further advances have been made list all advances (if available), comma delimited",Complete using non-negative numbers.
AR89,Optional,dynamic,Further Loan Advance Date,Loan Characteristics,Date,"Date last further advance was made. If several further advances have been made list all advance dates (if available), comma delimited",nan
AR90,Mandatory,static,Flexible Loan Amount,Loan Characteristics,Numeric,Current obligated amount (scheduled/unscheduled repayments) which can be drawn under the flexible loan by the borrower. Please provide details on the definition of the flexible loan amount. If loan is not flexible enter 0.,"Indicate the total amount which the borrower is entitled to draw on the loan without any additional review, underwriting or credit checks (i.e.. the loan limit). This may be a dynamic field."
AR91,Mandatory,static,Further Advances,Loan Characteristics,Y / N / ND,Possibility to have further advances i.e. advances above the original loan balance,"This should reference the possibility to take further advances on the loan without any additional review, underwriting or credit checks"
AR92,Optional,static,Length of Payment Holiday,Loan Characteristics,Text/Numeric,"The length of any payment holidays allowed, in months. If payment holidays not allowed enter 0",This should be completed where the loan terms permit a payment holiday (excluding payment holidays that are funded by overpayments on flexible loans and non-payment arrears concessions) and should represent the maximum number of months such payment holidays are permitted
